{
  "family": "tts",
  "capabilities": [
    "speech_reconstruction",
    "text_to_speech"
  ],
  "referenceVoice": true,
  "classification": "WAITING",
  "implementation": "implemented",
  "adapter": "file_runner",
  "supports_streaming_tts": false,
  "requiredPaths": [
    "tools/venvs/cosyvoice-wsl/bin/python",
    "tools/cosyvoice-infer.py",
    "tools/external/CosyVoice",
    "tools/external/CosyVoice/third_party/Matcha-TTS",
    "models/speech-reconstruction/cosyvoice",
    "tools/external/CosyVoice/asset/zero_shot_prompt.wav",
    "tools/fixtures/cosyvoice/prompt-text.txt"
  ],
  "modelPaths": [
    "models/speech-reconstruction/cosyvoice"
  ],
  "id": "cosyvoice",
  "name": "CosyVoice",
  "profiles": [
    "CosyVoice2"
  ],
  "limitations": [
    "目前只接 CosyVoice2 non-streaming file runner；supports_streaming_tts=false。",
    "CosyVoice3 維持 PLANNED，禁止由 Manual TTS request 啟動。",
    "Audio rack 與 virtual route 為 external/manual，route evidence 維持 WAITING。"
  ],
  "parameters": [
    {
      "name": "reference_text",
      "label": "Reference text",
      "type": "text",
      "level": "basic",
      "default": "",
      "runtime": false
    }
  ]
}
