{
  "family": "streaming-vc",
  "capabilities": [
    "realtime_vc"
  ],
  "referenceVoice": true,
  "classification": "WAITING",
  "implementation": "skeleton",
  "requiredPaths": [
    "tools/venvs/meanvc2/Scripts/python.exe",
    "tools/meanvc2-run.py",
    "tools/external/MeanVC2/runtime/run_rt.py",
    "models/meanvc2/vocos.pt",
    "models/meanvc2/wavlm_large_finetune.pth",
    "models/meanvc2/wavlm_large_cfg.pt",
    "models/meanvc2/meanvc2_40ms_40ms.safetensors",
    "models/meanvc2/fastu2pp_80ms.pt"
  ],
  "id": "meanvc2",
  "name": "MeanVC2",
  "adapter": "file_runner",
  "limitations": [
    "第一輪僅 WAV runner；官方 realtime 需互動選裝置，尚未接 Desktop headless。"
  ],
  "parameters": [
    {
      "name": "model",
      "label": "Model",
      "type": "select",
      "level": "basic",
      "default": "40ms",
      "options": [
        "40ms",
        "120ms"
      ],
      "runtime": false
    }
  ]
}
