{
  "family": "streaming-vc",
  "capabilities": [
    "realtime_vc"
  ],
  "referenceVoice": true,
  "classification": "WAITING",
  "implementation": "implemented",
  "requiredPaths": [
    "tools/venvs/seed-vc/Scripts/python.exe",
    "services/engines/stream_runtime.py",
    "services/engines/streaming_adapters.py",
    "services/engines/postfx.py",
    "tools/external/seed-vc/real-time-gui.py",
    "models/seed-vc/checkpoints/realtime-tiny/DiT_uvit_tat_xlsr_ema.pth",
    "tools/external/seed-vc/checkpoints/models--facebook--wav2vec2-xls-r-300m/refs/main",
    "tools/external/seed-vc/checkpoints/models--funasr--campplus/refs/main",
    "tools/external/seed-vc/checkpoints/models--FunAudioLLM--CosyVoice-300M/refs/main"
  ],
  "id": "seed-vc",
  "name": "Seed-VC",
  "profiles": [
    "realtime-tiny"
  ],
  "adapter": "stream_runner",
  "limitations": [
    "Desktop 使用 realtime-tiny FP32 / CUDA 0 常駐核心，START 直接開啟音訊串流。",
    "參考聲音需有效 WAV；物理麥克風聽評與 600 秒 LIVE_GATE 需獨立驗證。"
  ],
  "parameters": [
    {
      "name": "diffusion_steps",
      "label": "Diffusion steps",
      "type": "number",
      "level": "advanced",
      "default": 10,
      "min": 1,
      "max": 30,
      "step": 1,
      "runtime": false
    },
    {
      "name": "inference_cfg_rate",
      "label": "Inference CFG",
      "type": "number",
      "level": "advanced",
      "default": 0.7,
      "min": 0,
      "max": 1,
      "step": 0.1,
      "runtime": false
    },
    {
      "name": "max_prompt_length",
      "label": "Prompt length",
      "type": "number",
      "level": "advanced",
      "default": 3,
      "min": 1,
      "max": 20,
      "step": 0.5,
      "runtime": false
    },
    {
      "name": "block_time",
      "label": "Block time (s)",
      "type": "number",
      "level": "advanced",
      "default": 0.3,
      "min": 0.04,
      "max": 3,
      "step": 0.02,
      "runtime": false
    },
    {
      "name": "crossfade_length",
      "label": "Crossfade (s)",
      "type": "number",
      "level": "advanced",
      "default": 0.04,
      "min": 0.02,
      "max": 0.5,
      "step": 0.02,
      "runtime": false
    },
    {
      "name": "extra_time_ce",
      "label": "Extra context CE",
      "type": "number",
      "level": "advanced",
      "default": 5,
      "min": 0.5,
      "max": 10,
      "step": 0.1,
      "runtime": false
    },
    {
      "name": "extra_time",
      "label": "Extra time DiT",
      "type": "number",
      "level": "advanced",
      "default": 0.5,
      "min": 0.5,
      "max": 10,
      "step": 0.1,
      "runtime": false
    },
    {
      "name": "extra_time_right",
      "label": "Right context",
      "type": "number",
      "level": "advanced",
      "default": 0.02,
      "min": 0.02,
      "max": 10,
      "step": 0.02,
      "runtime": false
    }
  ]
}
